{
  "ontology_version": "0.1.0",
  "classification_id": "UCSF-C-000000001",
  "semantic_definition": {
    "canonical_name": "Test classification",
    "definition": "Test definition",
    "security_domain": "identity"
  },
  "dimensions": {
    "asset": [],
    "data": [],
    "trust": [],
    "threat": [],
    "risk": [],
    "security_objective": []
  },
  "relationships": [],
  "control_mappings": [
    {
      "control_id": "UCSF-CTRL-001",
      "mapping_type": "mandatory",
      "applicability": "Always applicable"
    }
  ],
  "lifecycle": {
    "status": "draft",
    "effective_version": "0.1.0",
    "supersed_by": null
  },
  "provenance": {
    "created_by": "test",
    "created_at": "2026-09-26T00:00:00Z",
    "source_reference": [
      "test-fixture"
    ],
    "change_reason": "initial test"
  }
}